{
  "schema_version": "2.0-rc1",
  "issue_id": "2026-W33",
  "research_profile": "WEEKLY",
  "publication_profile": "WEEKLY_MAGAZINE",
  "review_kind": "VISUAL",
  "status": "PASSED",
  "production_profile": {
    "path": "sources/2026-W33/production-profile.json",
    "sha256": "3cf51172cc1d8b80a0d7551202b31d5312f45a5258412c766dfd1eaf410e8066"
  },
  "reader_manuscript": {
    "path": "sources/2026-W33/publication/v2/editorial-corrections/ed-weekly-full-ren-u-v2/publication/reader-manuscript-v2.json",
    "sha256": "f36819720e320608e4494fb7991b17acb1b5ecadcb66fbc82cb3ebc6a785ef1a"
  },
  "source": {
    "path": "sources/2026-W33/publication/v2/editorial-corrections/ed-weekly-full-ren-u-v2/staged-source/main.tex",
    "sha256": "351f970c43e790a8d9bc1b748f77e4faebbac64edc88bf2db39ec804280a19a4",
    "byte_count": 2295
  },
  "pdf": {
    "path": "sources/2026-W33/publication/v2/editorial-corrections/ed-weekly-full-ren-u-v2/publication/build/main.pdf",
    "sha256": "66d4b07de62c6e1a448fa347b47d19a4bd93ee5e153063fc853caa7cee06e70b",
    "byte_count": 67712
  },
  "page_count": 5,
  "checks": [
    {
      "check_id": "EXACT_PDF_VISUAL_REVIEW",
      "status": "PASS",
      "detail": "synthetic explicitly-nongenuine editorial EXACT_PDF_VISUAL_REVIEW",
      "evidence_locations": [
        "main.pdf"
      ]
    },
    {
      "check_id": "WEEKLY_RENDERED_PAGE_REVIEW",
      "status": "PASS",
      "detail": "synthetic explicitly-nongenuine editorial WEEKLY_RENDERED_PAGE_REVIEW",
      "evidence_locations": [
        "main.pdf"
      ]
    }
  ],
  "reviewed_by": "SYNTHETIC_FIXTURE_REVIEWER_GENERAL_FULL_V2",
  "recorded_at": "2026-10-28T17:30:00Z",
  "review_sha256": "6e8fff2f5a3ffc89bfbe95eab3095a718591b42c02a3f96e1e27da41ab353b51"
}
