{
  "schema_version": "2.0-rc1",
  "issue_id": "2026-W33",
  "research_profile": "WEEKLY",
  "publication_profile": "WEEKLY_MAGAZINE",
  "review_kind": "VISUAL",
  "status": "PASSED",
  "production_profile": {
    "path": "sources/2026-W33/production-profile.json",
    "sha256": "3cf51172cc1d8b80a0d7551202b31d5312f45a5258412c766dfd1eaf410e8066"
  },
  "reader_manuscript": {
    "path": "sources/2026-W33/publication/v2/reader-manuscript-v2.json",
    "sha256": "9a37ebf221cbc8e052feae49cde8b6c39fa4dd3295269d192fea531033d7c796"
  },
  "source": {
    "path": "surveys/weekly/2026-W33/main.tex",
    "sha256": "e52adff0c352fd8a19efaba5cf725c64b5658446b201f7534b00e5d163b015c3",
    "byte_count": 2370
  },
  "pdf": {
    "path": "surveys/weekly/2026-W33/main.pdf",
    "sha256": "6d900c1fd4f8cfe41c69ead932a2aebe147f7bcb543b29d44f6525f296818119",
    "byte_count": 68591
  },
  "page_count": 5,
  "checks": [
    {
      "check_id": "EXACT_PDF_VISUAL_REVIEW",
      "status": "PASS",
      "detail": "synthetic explicitly-nongenuine EXACT_PDF_VISUAL_REVIEW",
      "evidence_locations": [
        "main.pdf"
      ]
    },
    {
      "check_id": "WEEKLY_RENDERED_PAGE_REVIEW",
      "status": "PASS",
      "detail": "synthetic explicitly-nongenuine WEEKLY_RENDERED_PAGE_REVIEW",
      "evidence_locations": [
        "main.pdf"
      ]
    }
  ],
  "reviewed_by": "SYNTHETIC_FIXTURE_REVIEWER_GENERAL_FULL_V2",
  "recorded_at": "2026-10-28T07:45:00Z",
  "review_sha256": "d5ce37803376efa99f269e50a19e8bf73993b61fa34f0d28e9189a9b10474966"
}
