{
  "schema_version": "2.0-rc1",
  "issue_id": "2026-W33",
  "research_profile": "WEEKLY",
  "publication_profile": "WEEKLY_MAGAZINE",
  "review_kind": "SEMANTIC_EDITORIAL",
  "status": "PASSED",
  "production_profile": {
    "path": "sources/2026-W33/production-profile.json",
    "sha256": "3cf51172cc1d8b80a0d7551202b31d5312f45a5258412c766dfd1eaf410e8066"
  },
  "reader_manuscript": {
    "path": "sources/2026-W33/publication/v2/reader-manuscript-v2.json",
    "sha256": "7860accf715d66f747427d5106fed5642eaf0558f57050305b075ecc0b3199f4"
  },
  "source": {
    "path": "surveys/weekly/2026-W33/main.tex",
    "sha256": "366c46236c5114d381a4fd5f818054d419e331ab224fab8368ea731444284fb3",
    "byte_count": 2202
  },
  "pdf": {
    "path": "surveys/weekly/2026-W33/main.pdf",
    "sha256": "9f2d41bd06ab83e58a00f39afbdf5fe1b0e36348177cc527a737f50aaf8f1178",
    "byte_count": 68126
  },
  "page_count": 5,
  "checks": [
    {
      "check_id": "ARCHITECTURE_CONTENT_FIDELITY",
      "status": "PASS",
      "detail": "synthetic explicitly-nongenuine ARCHITECTURE_CONTENT_FIDELITY",
      "evidence_locations": [
        "main.tex"
      ]
    },
    {
      "check_id": "BIBLIOGRAPHY_METADATA",
      "status": "PASS",
      "detail": "synthetic explicitly-nongenuine BIBLIOGRAPHY_METADATA",
      "evidence_locations": [
        "main.tex"
      ]
    },
    {
      "check_id": "FINAL_SYNTHESIS_QUALITY",
      "status": "PASS",
      "detail": "synthetic explicitly-nongenuine FINAL_SYNTHESIS_QUALITY",
      "evidence_locations": [
        "main.tex"
      ]
    },
    {
      "check_id": "POST_TRANSFORM_SEMANTIC_REVALIDATION",
      "status": "PASS",
      "detail": "synthetic explicitly-nongenuine POST_TRANSFORM_SEMANTIC_REVALIDATION",
      "evidence_locations": [
        "main.tex"
      ]
    },
    {
      "check_id": "PUBLICATION_BOUNDARY",
      "status": "PASS",
      "detail": "synthetic explicitly-nongenuine PUBLICATION_BOUNDARY",
      "evidence_locations": [
        "main.tex"
      ]
    },
    {
      "check_id": "SOURCE_SPECIFIC_FAIL_CLOSED_NOTES",
      "status": "PASS",
      "detail": "synthetic explicitly-nongenuine SOURCE_SPECIFIC_FAIL_CLOSED_NOTES",
      "evidence_locations": [
        "main.tex"
      ]
    },
    {
      "check_id": "WEEKLY_CARRY_OVER_DISPOSITION",
      "status": "PASS",
      "detail": "synthetic explicitly-nongenuine WEEKLY_CARRY_OVER_DISPOSITION",
      "evidence_locations": [
        "main.tex"
      ]
    },
    {
      "check_id": "WEEKLY_COMMUNITY_MOVEMENT",
      "status": "PASS",
      "detail": "synthetic explicitly-nongenuine WEEKLY_COMMUNITY_MOVEMENT",
      "evidence_locations": [
        "main.tex"
      ]
    },
    {
      "check_id": "WEEKLY_LATE_BREAKING_SINGLE_HOME",
      "status": "PASS",
      "detail": "synthetic explicitly-nongenuine WEEKLY_LATE_BREAKING_SINGLE_HOME",
      "evidence_locations": [
        "main.tex"
      ]
    },
    {
      "check_id": "WEEKLY_WATCHLIST_READER_SEMANTICS",
      "status": "PASS",
      "detail": "synthetic explicitly-nongenuine WEEKLY_WATCHLIST_READER_SEMANTICS",
      "evidence_locations": [
        "main.tex"
      ]
    },
    {
      "check_id": "WEEKLY_WHY_THIS_ISSUE",
      "status": "PASS",
      "detail": "synthetic explicitly-nongenuine WEEKLY_WHY_THIS_ISSUE",
      "evidence_locations": [
        "main.tex"
      ]
    }
  ],
  "reviewed_by": "SYNTHETIC_FIXTURE_REVIEWER_GENERAL_FULL_V2",
  "recorded_at": "2026-10-28T07:30:00Z",
  "review_sha256": "42613b60a6997cc7c578834fd970153e99f469092a8d0e889b0a8a43e8fb4fdd"
}
