{
  "schema_version": "2.0-rc1",
  "issue_id": "2026-W33",
  "research_profile": "WEEKLY",
  "publication_profile": "WEEKLY_MAGAZINE",
  "review_kind": "VISUAL",
  "status": "PASSED",
  "production_profile": {
    "path": "sources/2026-W33/production-profile.json",
    "sha256": "3cf51172cc1d8b80a0d7551202b31d5312f45a5258412c766dfd1eaf410e8066"
  },
  "reader_manuscript": {
    "path": "sources/2026-W33/publication/v2/editorial-corrections/ed-weekly-full-cuu-rel-v2/publication/reader-manuscript-v2.json",
    "sha256": "2a29133810448bb16d2abf258f1fe25ebd7008a939f5292b745618d31abcc6c6"
  },
  "source": {
    "path": "sources/2026-W33/publication/v2/editorial-corrections/ed-weekly-full-cuu-rel-v2/staged-source/main.tex",
    "sha256": "b0437b09798f367173588c9b9602403022c899ed726f148a054110072866c02c",
    "byte_count": 2323
  },
  "pdf": {
    "path": "sources/2026-W33/publication/v2/editorial-corrections/ed-weekly-full-cuu-rel-v2/publication/build/main.pdf",
    "sha256": "d776230f9a90dc9140d82178fb3d199f97de4a754ffbc82736c5207574380e01",
    "byte_count": 67729
  },
  "page_count": 5,
  "checks": [
    {
      "check_id": "EXACT_PDF_VISUAL_REVIEW",
      "status": "PASS",
      "detail": "synthetic explicitly-nongenuine editorial EXACT_PDF_VISUAL_REVIEW",
      "evidence_locations": [
        "main.pdf"
      ]
    },
    {
      "check_id": "WEEKLY_RENDERED_PAGE_REVIEW",
      "status": "PASS",
      "detail": "synthetic explicitly-nongenuine editorial WEEKLY_RENDERED_PAGE_REVIEW",
      "evidence_locations": [
        "main.pdf"
      ]
    }
  ],
  "reviewed_by": "SYNTHETIC_FIXTURE_REVIEWER_GENERAL_FULL_V2",
  "recorded_at": "2026-10-28T17:30:00Z",
  "review_sha256": "33c9b8155f594e56ed4f4153638a0f2e272197fab611c52da1435c7e1804404c"
}
