{
  "schema_version": "2.0-rc1",
  "issue_id": "SP001",
  "research_profile": "THEMATIC",
  "publication_profile": "LONGFORM_SPECIAL",
  "review_kind": "SEMANTIC_EDITORIAL",
  "status": "PASSED",
  "production_profile": {
    "path": "sources/SP001/production-profile.json",
    "sha256": "bace0752c0803638dee978cd240ec30ca18b6413fbdaee3da31d0228741b7b44"
  },
  "reader_manuscript": {
    "path": "sources/SP001/publication/v2/reader-manuscript-v2.json",
    "sha256": "e35da8d4382c25639e15918b27afd38cb573ea671b4dcccf39a8945fbd5b3d43"
  },
  "source": {
    "path": "surveys/special/SP001/main.tex",
    "sha256": "3f4dfaf11ccc8284a86ccc419bf323339951115f6f663905eecdf017f6068de5",
    "byte_count": 5787
  },
  "pdf": {
    "path": "surveys/special/SP001/main.pdf",
    "sha256": "167112082cd3ce506a430372b7906bc83156c30cb149b52302ff0bbc9bb90ffe",
    "byte_count": 85207
  },
  "page_count": 5,
  "checks": [
    {
      "check_id": "ARCHITECTURE_CONTENT_FIDELITY",
      "status": "PASS",
      "detail": "synthetic explicitly-nongenuine ARCHITECTURE_CONTENT_FIDELITY",
      "evidence_locations": [
        "package:pkg-core"
      ]
    },
    {
      "check_id": "BIBLIOGRAPHY_METADATA",
      "status": "PASS",
      "detail": "synthetic explicitly-nongenuine BIBLIOGRAPHY_METADATA",
      "evidence_locations": [
        "main.tex"
      ]
    },
    {
      "check_id": "FINAL_SYNTHESIS_QUALITY",
      "status": "PASS",
      "detail": "synthetic explicitly-nongenuine FINAL_SYNTHESIS_QUALITY",
      "evidence_locations": [
        "Section 3 — この号の総括",
        "package:pkg-core",
        "reader-role:final-synthesis"
      ]
    },
    {
      "check_id": "LONGFORM_TECHNICAL_DEPTH",
      "status": "PASS",
      "detail": "synthetic explicitly-nongenuine LONGFORM_TECHNICAL_DEPTH",
      "evidence_locations": [
        "density-review:below-target-substantive",
        "package:pkg-core",
        "page-plan:5/8"
      ]
    },
    {
      "check_id": "POST_TRANSFORM_SEMANTIC_REVALIDATION",
      "status": "PASS",
      "detail": "synthetic explicitly-nongenuine POST_TRANSFORM_SEMANTIC_REVALIDATION",
      "evidence_locations": [
        "main.tex"
      ]
    },
    {
      "check_id": "PUBLICATION_BOUNDARY",
      "status": "PASS",
      "detail": "synthetic explicitly-nongenuine PUBLICATION_BOUNDARY",
      "evidence_locations": [
        "main.tex"
      ]
    },
    {
      "check_id": "SOURCE_SPECIFIC_FAIL_CLOSED_NOTES",
      "status": "PASS",
      "detail": "synthetic explicitly-nongenuine SOURCE_SPECIFIC_FAIL_CLOSED_NOTES",
      "evidence_locations": [
        "main.tex"
      ]
    },
    {
      "check_id": "THEMATIC_HISTORICAL_ATTRIBUTION",
      "status": "PASS",
      "detail": "synthetic explicitly-nongenuine THEMATIC_HISTORICAL_ATTRIBUTION",
      "evidence_locations": [
        "main.tex"
      ]
    },
    {
      "check_id": "THEMATIC_RESEARCH_CLOSURE",
      "status": "PASS",
      "detail": "synthetic explicitly-nongenuine THEMATIC_RESEARCH_CLOSURE",
      "evidence_locations": [
        "main.tex"
      ]
    }
  ],
  "reviewed_by": "SYNTHETIC_FIXTURE_REVIEWER_GENERAL_FULL_V2",
  "recorded_at": "2026-10-28T07:30:00Z",
  "review_sha256": "ad11619e54fa6863fd3d7ec55876bbadce82a75497ef9247c5c6ecff744639d5"
}
