{
  "schema_version": "2.0-rc1",
  "issue_id": "2026-W33",
  "research_profile": "WEEKLY",
  "publication_profile": "WEEKLY_MAGAZINE",
  "review_kind": "SEMANTIC_EDITORIAL",
  "status": "PASSED",
  "production_profile": {
    "path": "sources/2026-W33/production-profile.json",
    "sha256": "3cf51172cc1d8b80a0d7551202b31d5312f45a5258412c766dfd1eaf410e8066"
  },
  "reader_manuscript": {
    "path": "sources/2026-W33/publication/v2/editorial-corrections/ed-weekly-full-cuu-rel-v2/publication/reader-manuscript-v2.json",
    "sha256": "38527b669fe1da4e3983750be8f6d94c830791e8e50323618b306a32ca6e2a89"
  },
  "source": {
    "path": "sources/2026-W33/publication/v2/editorial-corrections/ed-weekly-full-cuu-rel-v2/staged-source/main.tex",
    "sha256": "b0437b09798f367173588c9b9602403022c899ed726f148a054110072866c02c",
    "byte_count": 2323
  },
  "pdf": {
    "path": "sources/2026-W33/publication/v2/editorial-corrections/ed-weekly-full-cuu-rel-v2/publication/build/main.pdf",
    "sha256": "86e477d3fd72a52e7609d79fc552d43a1817eb3e1d566e6ca61dacf20ca7bb7d",
    "byte_count": 67729
  },
  "page_count": 5,
  "checks": [
    {
      "check_id": "ARCHITECTURE_CONTENT_FIDELITY",
      "status": "PASS",
      "detail": "synthetic explicitly-nongenuine editorial ARCHITECTURE_CONTENT_FIDELITY",
      "evidence_locations": [
        "main.tex"
      ]
    },
    {
      "check_id": "BIBLIOGRAPHY_METADATA",
      "status": "PASS",
      "detail": "synthetic explicitly-nongenuine editorial BIBLIOGRAPHY_METADATA",
      "evidence_locations": [
        "main.tex"
      ]
    },
    {
      "check_id": "FINAL_SYNTHESIS_QUALITY",
      "status": "PASS",
      "detail": "synthetic explicitly-nongenuine editorial FINAL_SYNTHESIS_QUALITY",
      "evidence_locations": [
        "main.tex"
      ]
    },
    {
      "check_id": "POST_TRANSFORM_SEMANTIC_REVALIDATION",
      "status": "PASS",
      "detail": "synthetic explicitly-nongenuine editorial POST_TRANSFORM_SEMANTIC_REVALIDATION",
      "evidence_locations": [
        "main.tex"
      ]
    },
    {
      "check_id": "PUBLICATION_BOUNDARY",
      "status": "PASS",
      "detail": "synthetic explicitly-nongenuine editorial PUBLICATION_BOUNDARY",
      "evidence_locations": [
        "main.tex"
      ]
    },
    {
      "check_id": "SOURCE_SPECIFIC_FAIL_CLOSED_NOTES",
      "status": "PASS",
      "detail": "synthetic explicitly-nongenuine editorial SOURCE_SPECIFIC_FAIL_CLOSED_NOTES",
      "evidence_locations": [
        "main.tex"
      ]
    },
    {
      "check_id": "WEEKLY_CARRY_OVER_DISPOSITION",
      "status": "PASS",
      "detail": "synthetic explicitly-nongenuine editorial WEEKLY_CARRY_OVER_DISPOSITION",
      "evidence_locations": [
        "main.tex"
      ]
    },
    {
      "check_id": "WEEKLY_COMMUNITY_MOVEMENT",
      "status": "PASS",
      "detail": "synthetic explicitly-nongenuine editorial WEEKLY_COMMUNITY_MOVEMENT",
      "evidence_locations": [
        "main.tex"
      ]
    },
    {
      "check_id": "WEEKLY_LATE_BREAKING_SINGLE_HOME",
      "status": "PASS",
      "detail": "synthetic explicitly-nongenuine editorial WEEKLY_LATE_BREAKING_SINGLE_HOME",
      "evidence_locations": [
        "main.tex"
      ]
    },
    {
      "check_id": "WEEKLY_WATCHLIST_READER_SEMANTICS",
      "status": "PASS",
      "detail": "synthetic explicitly-nongenuine editorial WEEKLY_WATCHLIST_READER_SEMANTICS",
      "evidence_locations": [
        "main.tex"
      ]
    },
    {
      "check_id": "WEEKLY_WHY_THIS_ISSUE",
      "status": "PASS",
      "detail": "synthetic explicitly-nongenuine editorial WEEKLY_WHY_THIS_ISSUE",
      "evidence_locations": [
        "main.tex"
      ]
    }
  ],
  "reviewed_by": "SYNTHETIC_FIXTURE_REVIEWER_GENERAL_FULL_V2",
  "recorded_at": "2026-10-28T17:30:00Z",
  "review_sha256": "da8d38c8cad70d592394df109d2c1404513b2924b72bd152e31431352f555b54"
}
