{
  "schema_version": "2.0-rc1",
  "issue_id": "SP001",
  "research_profile": "THEMATIC",
  "publication_profile": "LONGFORM_SPECIAL",
  "review_kind": "VISUAL",
  "status": "PASSED",
  "production_profile": {
    "path": "sources/SP001/production-profile.json",
    "sha256": "bace0752c0803638dee978cd240ec30ca18b6413fbdaee3da31d0228741b7b44"
  },
  "reader_manuscript": {
    "path": "sources/SP001/publication/v2/reader-manuscript-v2.json",
    "sha256": "32e8c523f7deb8fbc4835aabc472880603a4a303b286f9089503fe52194fc1f2"
  },
  "source": {
    "path": "surveys/special/SP001/main.tex",
    "sha256": "c0111f7ec14146b4f753723c1e0153a597f12b035756ae6481aabf15a495c8fe",
    "byte_count": 5787
  },
  "pdf": {
    "path": "surveys/special/SP001/main.pdf",
    "sha256": "620fb5beb33ac929e6446e7bd250c11b3709124aa551260d9b88eba94179e883",
    "byte_count": 84841
  },
  "page_count": 5,
  "checks": [
    {
      "check_id": "EXACT_PDF_VISUAL_REVIEW",
      "status": "PASS",
      "detail": "synthetic explicitly-nongenuine EXACT_PDF_VISUAL_REVIEW",
      "evidence_locations": [
        "main.pdf"
      ]
    },
    {
      "check_id": "LONGFORM_MIXED_LAYOUT",
      "status": "PASS",
      "detail": "synthetic explicitly-nongenuine LONGFORM_MIXED_LAYOUT",
      "evidence_locations": [
        "reader-layout:wide-surfaces-full-width",
        "reader-layout:references-one-column",
        "reader-layout:balanced-two-column-narrative"
      ]
    },
    {
      "check_id": "LONGFORM_PAGE_BALANCE",
      "status": "PASS",
      "detail": "synthetic explicitly-nongenuine LONGFORM_PAGE_BALANCE",
      "evidence_locations": [
        "main.pdf"
      ]
    },
    {
      "check_id": "TECHNICAL_NOTES_TAIL_NEEDSPACE",
      "status": "PASS",
      "detail": "synthetic explicitly-nongenuine TECHNICAL_NOTES_TAIL_NEEDSPACE",
      "evidence_locations": [
        "main.pdf"
      ]
    },
    {
      "check_id": "TOC_HIERARCHY",
      "status": "PASS",
      "detail": "synthetic explicitly-nongenuine TOC_HIERARCHY",
      "evidence_locations": [
        "main.pdf"
      ]
    }
  ],
  "reviewed_by": "SYNTHETIC_FIXTURE_REVIEWER_GENERAL_FULL_V2",
  "recorded_at": "2026-10-28T07:45:00Z",
  "review_sha256": "a2d308da5ee2b7ce4578379f4a7bae1143b9d444af74a764408b2f2d506ecabe"
}
