{
  "schema_version": "2.0-rc1",
  "issue_id": "SP001",
  "research_profile": "THEMATIC",
  "publication_profile": "LONGFORM_SPECIAL",
  "review_kind": "VISUAL",
  "status": "PASSED",
  "production_profile": {
    "path": "sources/SP001/production-profile.json",
    "sha256": "bace0752c0803638dee978cd240ec30ca18b6413fbdaee3da31d0228741b7b44"
  },
  "reader_manuscript": {
    "path": "sources/SP001/publication/v2/editorial-corrections/ed-thematic-full-ren-c-v2/publication/reader-manuscript-v2.json",
    "sha256": "fa904e4b2390bcebda40a4b2bc1ce9ecafea5e748a486a1a03003ba4c12fac43"
  },
  "source": {
    "path": "sources/SP001/publication/v2/editorial-corrections/ed-thematic-full-ren-c-v2/staged-source/main.tex",
    "sha256": "4dda1b746a2001f5cdde558792c18010065e56aaf4789a8b57167cc9285ea14b",
    "byte_count": 5954
  },
  "pdf": {
    "path": "sources/SP001/publication/v2/editorial-corrections/ed-thematic-full-ren-c-v2/publication/build/main.pdf",
    "sha256": "5ef7c7f0955a4d1cf61314323016a45e02c5663edd558878668714e1fb7dd07c",
    "byte_count": 85756
  },
  "page_count": 5,
  "checks": [
    {
      "check_id": "EXACT_PDF_VISUAL_REVIEW",
      "status": "PASS",
      "detail": "synthetic explicitly-nongenuine EXACT_PDF_VISUAL_REVIEW",
      "evidence_locations": [
        "main.pdf"
      ]
    },
    {
      "check_id": "LONGFORM_MIXED_LAYOUT",
      "status": "PASS",
      "detail": "synthetic explicitly-nongenuine LONGFORM_MIXED_LAYOUT",
      "evidence_locations": [
        "reader-layout:wide-surfaces-full-width",
        "reader-layout:references-one-column",
        "reader-layout:balanced-two-column-narrative"
      ]
    },
    {
      "check_id": "LONGFORM_PAGE_BALANCE",
      "status": "PASS",
      "detail": "synthetic explicitly-nongenuine LONGFORM_PAGE_BALANCE",
      "evidence_locations": [
        "main.pdf"
      ]
    },
    {
      "check_id": "TECHNICAL_NOTES_TAIL_NEEDSPACE",
      "status": "PASS",
      "detail": "synthetic explicitly-nongenuine TECHNICAL_NOTES_TAIL_NEEDSPACE",
      "evidence_locations": [
        "main.pdf"
      ]
    },
    {
      "check_id": "TOC_HIERARCHY",
      "status": "PASS",
      "detail": "synthetic explicitly-nongenuine TOC_HIERARCHY",
      "evidence_locations": [
        "main.pdf"
      ]
    }
  ],
  "reviewed_by": "SYNTHETIC_FIXTURE_REVIEWER_GENERAL_FULL_V2",
  "recorded_at": "2026-10-28T17:30:00Z",
  "review_sha256": "0232dbac703dc1b050d9361e61624b8625e1a2c69a1d97a215ad8e435a64dc66"
}
