{
  "schema_version": "2.0-rc1",
  "issue_id": "SP001",
  "research_profile": "THEMATIC",
  "publication_profile": "LONGFORM_SPECIAL",
  "review_kind": "VISUAL",
  "status": "PASSED",
  "production_profile": {
    "path": "sources/SP001/production-profile.json",
    "sha256": "bace0752c0803638dee978cd240ec30ca18b6413fbdaee3da31d0228741b7b44"
  },
  "reader_manuscript": {
    "path": "sources/SP001/publication/v2/editorial-corrections/ed-thematic-full-ren-u-v2/publication/reader-manuscript-v2.json",
    "sha256": "cb6d7b84e92500f83f1923abea475e1656936805d359ad73dbc913d04b2cf203"
  },
  "source": {
    "path": "sources/SP001/publication/v2/editorial-corrections/ed-thematic-full-ren-u-v2/staged-source/main.tex",
    "sha256": "ace3f189ab6ba584dc654740255cf2dd43ee1e0fd400875574472d561157a2c2",
    "byte_count": 5954
  },
  "pdf": {
    "path": "sources/SP001/publication/v2/editorial-corrections/ed-thematic-full-ren-u-v2/publication/build/main.pdf",
    "sha256": "a72d1689dc9a6ae2542fd77779f14cc21374bc5de79d82daa126cb5d537b03cc",
    "byte_count": 85761
  },
  "page_count": 5,
  "checks": [
    {
      "check_id": "EXACT_PDF_VISUAL_REVIEW",
      "status": "PASS",
      "detail": "synthetic explicitly-nongenuine EXACT_PDF_VISUAL_REVIEW",
      "evidence_locations": [
        "main.pdf"
      ]
    },
    {
      "check_id": "LONGFORM_MIXED_LAYOUT",
      "status": "PASS",
      "detail": "synthetic explicitly-nongenuine LONGFORM_MIXED_LAYOUT",
      "evidence_locations": [
        "reader-layout:wide-surfaces-full-width",
        "reader-layout:references-one-column",
        "reader-layout:balanced-two-column-narrative"
      ]
    },
    {
      "check_id": "LONGFORM_PAGE_BALANCE",
      "status": "PASS",
      "detail": "synthetic explicitly-nongenuine LONGFORM_PAGE_BALANCE",
      "evidence_locations": [
        "main.pdf"
      ]
    },
    {
      "check_id": "TECHNICAL_NOTES_TAIL_NEEDSPACE",
      "status": "PASS",
      "detail": "synthetic explicitly-nongenuine TECHNICAL_NOTES_TAIL_NEEDSPACE",
      "evidence_locations": [
        "main.pdf"
      ]
    },
    {
      "check_id": "TOC_HIERARCHY",
      "status": "PASS",
      "detail": "synthetic explicitly-nongenuine TOC_HIERARCHY",
      "evidence_locations": [
        "main.pdf"
      ]
    }
  ],
  "reviewed_by": "SYNTHETIC_FIXTURE_REVIEWER_GENERAL_FULL_V2",
  "recorded_at": "2026-10-28T17:30:00Z",
  "review_sha256": "439bcfafb520aba3551bc2243c81f0b524b7f3bb2d9f4b804add530a143441f4"
}
