{
  "schema_version": "2.0-rc1",
  "issue_id": "2026-W33",
  "research_profile": "WEEKLY",
  "publication_profile": "WEEKLY_MAGAZINE",
  "review_kind": "VISUAL",
  "status": "PASSED",
  "production_profile": {
    "path": "sources/2026-W33/production-profile.json",
    "sha256": "3cf51172cc1d8b80a0d7551202b31d5312f45a5258412c766dfd1eaf410e8066"
  },
  "reader_manuscript": {
    "path": "sources/2026-W33/publication/v2/editorial-corrections/ed-weekly-full-ren-c-v2/publication/reader-manuscript-v2.json",
    "sha256": "240a329483abdb5846f3cbd018fe8f8d364791808539e368a306b64a1cac4c09"
  },
  "source": {
    "path": "sources/2026-W33/publication/v2/editorial-corrections/ed-weekly-full-ren-c-v2/staged-source/main.tex",
    "sha256": "e60d6330e2b0f23087a1fb2fde9783d94728afa49873247d61cc20d3323a3dfc",
    "byte_count": 2295
  },
  "pdf": {
    "path": "sources/2026-W33/publication/v2/editorial-corrections/ed-weekly-full-ren-c-v2/publication/build/main.pdf",
    "sha256": "bb5c3beb9d4c418909f7bbcfb6e2b092bdbf455e60a79910aafd5d473cff2cea",
    "byte_count": 67715
  },
  "page_count": 5,
  "checks": [
    {
      "check_id": "EXACT_PDF_VISUAL_REVIEW",
      "status": "PASS",
      "detail": "synthetic explicitly-nongenuine editorial EXACT_PDF_VISUAL_REVIEW",
      "evidence_locations": [
        "main.pdf"
      ]
    },
    {
      "check_id": "WEEKLY_RENDERED_PAGE_REVIEW",
      "status": "PASS",
      "detail": "synthetic explicitly-nongenuine editorial WEEKLY_RENDERED_PAGE_REVIEW",
      "evidence_locations": [
        "main.pdf"
      ]
    }
  ],
  "reviewed_by": "SYNTHETIC_FIXTURE_REVIEWER_GENERAL_FULL_V2",
  "recorded_at": "2026-10-28T17:30:00Z",
  "review_sha256": "c75f7a5073e0aea8705e014a360fa47ee883bf4b1f4fe669391ca6b0c21183a1"
}
