{
  "schema_version": "2.0-rc1",
  "issue_id": "SP001",
  "research_profile": "THEMATIC",
  "publication_profile": "LONGFORM_SPECIAL",
  "review_kind": "VISUAL",
  "status": "PASSED",
  "production_profile": {
    "path": "sources/SP001/production-profile.json",
    "sha256": "bace0752c0803638dee978cd240ec30ca18b6413fbdaee3da31d0228741b7b44"
  },
  "reader_manuscript": {
    "path": "sources/SP001/publication/v2/editorial-corrections/ed-thematic-full-cuu-rel-v2/renewals/ren-thematic-cuu-c-v2/reader-manuscript-v2.json",
    "sha256": "5e50a183ec42be16b5db7819964ecd24e97fa0d9fc050a4aec7220cd371a0139"
  },
  "source": {
    "path": "sources/SP001/publication/v2/editorial-corrections/ed-thematic-full-cuu-rel-v2/renewals/ren-thematic-cuu-c-v2/staged-source/main.tex",
    "sha256": "f394b247ac77ff2d890ebca2784547765deefa4616748e1876b9213728a42e87",
    "byte_count": 6056
  },
  "pdf": {
    "path": "sources/SP001/publication/v2/editorial-corrections/ed-thematic-full-cuu-rel-v2/renewals/ren-thematic-cuu-c-v2/build/main.pdf",
    "sha256": "f2f9fc7f80ada732d7aa8bf00c6747fb66892c578d59ab70715ef2bbc1b9a778",
    "byte_count": 85830
  },
  "page_count": 5,
  "checks": [
    {
      "check_id": "EXACT_PDF_VISUAL_REVIEW",
      "status": "PASS",
      "detail": "synthetic renewal C EXACT_PDF_VISUAL_REVIEW",
      "evidence_locations": [
        "main.pdf"
      ]
    },
    {
      "check_id": "LONGFORM_MIXED_LAYOUT",
      "status": "PASS",
      "detail": "synthetic renewal C LONGFORM_MIXED_LAYOUT",
      "evidence_locations": [
        "reader-layout:wide-surfaces-full-width",
        "reader-layout:references-one-column",
        "reader-layout:balanced-two-column-narrative"
      ]
    },
    {
      "check_id": "LONGFORM_PAGE_BALANCE",
      "status": "PASS",
      "detail": "synthetic renewal C LONGFORM_PAGE_BALANCE",
      "evidence_locations": [
        "main.pdf"
      ]
    },
    {
      "check_id": "TECHNICAL_NOTES_TAIL_NEEDSPACE",
      "status": "PASS",
      "detail": "synthetic renewal C TECHNICAL_NOTES_TAIL_NEEDSPACE",
      "evidence_locations": [
        "main.pdf"
      ]
    },
    {
      "check_id": "TOC_HIERARCHY",
      "status": "PASS",
      "detail": "synthetic renewal C TOC_HIERARCHY",
      "evidence_locations": [
        "main.pdf"
      ]
    }
  ],
  "reviewed_by": "SYNTHETIC_FIXTURE_REVIEWER_GENERAL_FULL_V2",
  "recorded_at": "2026-10-28T21:00:00Z",
  "review_sha256": "7055e5bf3e752215cd904c044dd5dfb135dc0b6d0d6da470c3daf0f02158dd16"
}
